{
  "abilities": [
    {
      "name": "ice-face",
      "url": "https://thepokeapi.com/ability/ice-face",
      "is_hidden": false,
      "slot": 1
    }
  ],
  "capture_rate": 60,
  "color": "blue",
  "damage_multipliers": {
    "normal": 1,
    "fire": 4,
    "water": 1,
    "electric": 1,
    "grass": 0,
    "ice": 0,
    "fighting": 1,
    "poison": 1,
    "ground": 0,
    "flying": 2,
    "psychic": 1,
    "bug": 1,
    "rock": 4,
    "ghost": 1,
    "dragon": 1,
    "dark": 1,
    "steel": 2,
    "fairy": 1
  },
  "description": "This Pok\u00e9mon keeps its heat-sensitive head cool with ice. It fishes for its food, dangling its single hair into the sea to lure in prey.",
  "egg_groups": [],
  "evolution_chain": [
    [
      "eiscue"
    ]
  ],
  "evolves_from_species": null,
  "growth_rate": "slow",
  "height": 55,
  "id": 875,
  "is_baby": false,
  "is_legendary": false,
  "is_mythical": false,
  "moves": [
    {
      "name": "powder snow",
      "level": 1,
      "tm": false
    },
    {
      "name": "tackle",
      "level": 1,
      "tm": false
    },
    {
      "name": "mist",
      "level": 6,
      "tm": false
    },
    {
      "name": "weather ball",
      "level": 12,
      "tm": false
    },
    {
      "name": "icy wind",
      "level": 18,
      "tm": false
    },
    {
      "name": "headbutt",
      "level": 24,
      "tm": false
    },
    {
      "name": "amnesia",
      "level": 30,
      "tm": false
    },
    {
      "name": "freeze-dry",
      "level": 36,
      "tm": false
    },
    {
      "name": "hail",
      "level": 42,
      "tm": false
    },
    {
      "name": "aurora veil",
      "level": 48,
      "tm": false
    },
    {
      "name": "surf",
      "level": 54,
      "tm": false
    },
    {
      "name": "blizzard",
      "level": 60,
      "tm": false
    },
    {
      "name": "soak",
      "tm": false,
      "level": null
    },
    {
      "name": "aqua ring",
      "tm": false,
      "level": null
    },
    {
      "name": "belly drum",
      "tm": false,
      "level": null
    },
    {
      "name": "double-edge",
      "tm": false,
      "level": null
    },
    {
      "name": "icicle crash",
      "tm": false,
      "level": null
    },
    {
      "name": "head smash",
      "tm": false,
      "level": null
    },
    {
      "name": "dynamic-punch",
      "tm": true,
      "level": null
    },
    {
      "name": "work-up",
      "tm": true,
      "level": null
    },
    {
      "name": "headbutt",
      "tm": true,
      "level": null
    },
    {
      "name": "dragon-claw",
      "tm": true,
      "level": null
    },
    {
      "name": "dragon-claw",
      "tm": true,
      "level": null
    },
    {
      "name": "dragon-claw",
      "tm": true,
      "level": null
    },
    {
      "name": "dragon-claw",
      "tm": true,
      "level": null
    },
    {
      "name": "dragon-claw",
      "tm": true,
      "level": null
    },
    {
      "name": "dragon-claw",
      "tm": true,
      "level": null
    },
    {
      "name": "curse",
      "tm": true,
      "level": null
    },
    {
      "name": "water-pulse",
      "tm": true,
      "level": null
    },
    {
      "name": "water-pulse",
      "tm": true,
      "level": null
    },
    {
      "name": "psyshock",
      "tm": true,
      "level": null
    },
    {
      "name": "whirlwind",
      "tm": true,
      "level": null
    },
    {
      "name": "calm-mind",
      "tm": true,
      "level": null
    },
    {
      "name": "roar",
      "tm": true,
      "level": null
    }
  ],
  "name": "eiscue-ice",
  "names": {
    "french": "Bekagla\u00e7on",
    "german": "Kubuin",
    "spanish": "Eiscue",
    "italian": "Eiscue",
    "english": "Eiscue",
    "japanese": "\u30b3\u30aa\u30ea\u30c3\u30dd"
  },
  "pokedex_numbers": {
    "national": 875,
    "galar": 370,
    "crown-tundra": 90,
    "kanto": null,
    "original-johto": null,
    "updated-johto": null,
    "kalos-central": null,
    "isle-of-armor": null,
    "updated-kanto": null,
    "conquest-gallery": null,
    "original-alola": null,
    "original-melemele": null,
    "original-akala": null,
    "updated-alola": null,
    "updated-melemele": null,
    "updated-akala": null,
    "updated-unova": null,
    "original-ulaula": null,
    "original-poni": null,
    "updated-ulaula": null,
    "updated-poni": null,
    "kalos-mountain": null,
    "hoenn": null,
    "original-sinnoh": null,
    "extended-sinnoh": null,
    "updated-hoenn": null,
    "kalos-coastal": null,
    "original-unova": null
  },
  "region": "galar",
  "region_id": 8,
  "shape": "upright",
  "species": "Penguin Pok\u00e9mon",
  "sprites": {
    "default": "https://raw.githubusercontent.com/hostedposted/PokemonData/master/sprites/pokemon/875.png",
    "shiny": "https://raw.githubusercontent.com/hostedposted/PokemonData/master/sprites/pokemon/shiny/875.png"
  },
  "stats": [
    {
      "name": "hp",
      "base_stat": 75
    },
    {
      "name": "attack",
      "base_stat": 80
    },
    {
      "name": "defense",
      "base_stat": 110
    },
    {
      "name": "special-attack",
      "base_stat": 65
    },
    {
      "name": "special-defense",
      "base_stat": 90
    },
    {
      "name": "speed",
      "base_stat": 50
    }
  ],
  "types": [
    {
      "name": "ice",
      "url": "https://thepokeapi.com/type/ice"
    }
  ],
  "weight_kilograms": 89,
  "weight_pounds": 196
}