{
  "abilities": [
    {
      "name": "cute-charm",
      "url": "https://thepokeapi.com/ability/cute-charm",
      "is_hidden": false,
      "slot": 1
    },
    {
      "name": "pixilate",
      "url": "https://thepokeapi.com/ability/pixilate",
      "is_hidden": true,
      "slot": 3
    }
  ],
  "capture_rate": 45,
  "color": "pink",
  "damage_multipliers": {
    "normal": 1,
    "fire": 2,
    "water": 1,
    "electric": 1,
    "grass": 1,
    "ice": 0,
    "fighting": 1,
    "poison": 2,
    "ground": 1,
    "flying": 1,
    "psychic": 1,
    "bug": 0,
    "rock": 2,
    "ghost": 1,
    "dragon": 0,
    "dark": 0,
    "steel": 4,
    "fairy": 1
  },
  "description": "Sylveon wraps its ribbonlike feelers around its Trainer\u2019s arm because this touch enables it to read its Trainer\u2019s feelings.",
  "egg_groups": [
    "ground"
  ],
  "evolution_chain": [
    [
      "eevee"
    ],
    [
      "vaporeon",
      "jolteon",
      "flareon",
      "espeon",
      "umbreon",
      "leafeon",
      "glaceon",
      "sylveon"
    ]
  ],
  "evolves_from_species": "eevee",
  "growth_rate": "medium",
  "height": 39,
  "id": 700,
  "is_baby": false,
  "is_legendary": false,
  "is_mythical": false,
  "moves": [
    {
      "name": "cut",
      "tm": true,
      "level": null
    },
    {
      "name": "sand-attack",
      "level": 5,
      "tm": false
    },
    {
      "name": "tackle",
      "level": 1,
      "tm": false
    },
    {
      "name": "tail-whip",
      "level": 1,
      "tm": false
    },
    {
      "name": "hyper-beam",
      "tm": true,
      "level": null
    },
    {
      "name": "dig",
      "tm": true,
      "level": null
    },
    {
      "name": "toxic",
      "tm": true,
      "level": null
    },
    {
      "name": "quick-attack",
      "level": 13,
      "tm": false
    },
    {
      "name": "double-team",
      "tm": true,
      "level": null
    },
    {
      "name": "light-screen",
      "level": 33,
      "tm": false
    },
    {
      "name": "reflect",
      "tm": true,
      "level": null
    },
    {
      "name": "swift",
      "level": 17,
      "tm": false
    },
    {
      "name": "flash",
      "tm": true,
      "level": null
    },
    {
      "name": "rest",
      "tm": true,
      "level": null
    },
    {
      "name": "substitute",
      "tm": true,
      "level": null
    },
    {
      "name": "snore",
      "level": 0,
      "tm": false
    },
    {
      "name": "protect",
      "tm": true,
      "level": null
    },
    {
      "name": "swagger",
      "tm": true,
      "level": null
    },
    {
      "name": "attract",
      "tm": true,
      "level": null
    },
    {
      "name": "sleep-talk",
      "tm": true,
      "level": null
    },
    {
      "name": "heal-bell",
      "level": 0,
      "tm": false
    },
    {
      "name": "return",
      "tm": true,
      "level": null
    },
    {
      "name": "frustration",
      "tm": true,
      "level": null
    },
    {
      "name": "safeguard",
      "tm": true,
      "level": null
    },
    {
      "name": "iron-tail",
      "level": 0,
      "tm": false
    },
    {
      "name": "hidden-power",
      "tm": true,
      "level": null
    },
    {
      "name": "rain-dance",
      "tm": true,
      "level": null
    },
    {
      "name": "sunny-day",
      "tm": true,
      "level": null
    },
    {
      "name": "psych-up",
      "level": 45,
      "tm": false
    },
    {
      "name": "shadow-ball",
      "tm": true,
      "level": null
    },
    {
      "name": "facade",
      "tm": true,
      "level": null
    },
    {
      "name": "helping-hand",
      "level": 1,
      "tm": false
    },
    {
      "name": "magic-coat",
      "level": 0,
      "tm": false
    },
    {
      "name": "skill-swap",
      "level": 25,
      "tm": false
    },
    {
      "name": "secret-power",
      "tm": true,
      "level": null
    },
    {
      "name": "hyper-voice",
      "level": 0,
      "tm": false
    },
    {
      "name": "covet",
      "level": 0,
      "tm": false
    },
    {
      "name": "calm-mind",
      "tm": true,
      "level": null
    },
    {
      "name": "last-resort",
      "level": 41,
      "tm": false
    },
    {
      "name": "giga-impact",
      "tm": true,
      "level": null
    },
    {
      "name": "psyshock",
      "tm": true,
      "level": null
    },
    {
      "name": "round",
      "tm": true,
      "level": null
    },
    {
      "name": "echoed-voice",
      "tm": true,
      "level": null
    },
    {
      "name": "retaliate",
      "tm": true,
      "level": null
    },
    {
      "name": "work-up",
      "tm": true,
      "level": null
    },
    {
      "name": "disarming-voice",
      "level": 1,
      "tm": false
    },
    {
      "name": "draining-kiss",
      "level": 20,
      "tm": false
    },
    {
      "name": "misty-terrain",
      "level": 29,
      "tm": false
    },
    {
      "name": "fairy-wind",
      "level": 9,
      "tm": false
    },
    {
      "name": "moonblast",
      "level": 37,
      "tm": false
    },
    {
      "name": "confide",
      "tm": true,
      "level": null
    },
    {
      "name": "dazzling-gleam",
      "tm": true,
      "level": null
    },
    {
      "name": "baby-doll-eyes",
      "level": 9,
      "tm": false
    }
  ],
  "name": "sylveon",
  "names": {
    "french": "Nymphali",
    "german": "Feelinara",
    "spanish": "Sylveon",
    "italian": "Sylveon",
    "english": "Sylveon",
    "japanese": "\u30cb\u30f3\u30d5\u30a3\u30a2"
  },
  "pokedex_numbers": {
    "national": {
      "id": 700,
      "url": "https://thepokeapi.com/pokedex/national"
    },
    "kalos-coastal": {
      "id": 85,
      "url": "https://thepokeapi.com/pokedex/kalos-coastal"
    },
    "original-alola": {
      "id": 131,
      "url": "https://thepokeapi.com/pokedex/original-alola"
    },
    "original-akala": {
      "id": 58,
      "url": "https://thepokeapi.com/pokedex/original-akala"
    },
    "updated-alola": {
      "id": 161,
      "url": "https://thepokeapi.com/pokedex/updated-alola"
    },
    "updated-akala": {
      "id": 62,
      "url": "https://thepokeapi.com/pokedex/updated-akala"
    },
    "galar": {
      "id": 204,
      "url": "https://thepokeapi.com/pokedex/galar"
    },
    "crown-tundra": {
      "id": 82,
      "url": "https://thepokeapi.com/pokedex/crown-tundra"
    },
    "kanto": {
      "id": null,
      "url": "https://thepokeapi.com/pokedex/kanto"
    },
    "original-johto": {
      "id": null,
      "url": "https://thepokeapi.com/pokedex/original-johto"
    },
    "updated-johto": {
      "id": null,
      "url": "https://thepokeapi.com/pokedex/updated-johto"
    },
    "kalos-central": {
      "id": null,
      "url": "https://thepokeapi.com/pokedex/kalos-central"
    },
    "isle-of-armor": {
      "id": null,
      "url": "https://thepokeapi.com/pokedex/isle-of-armor"
    },
    "updated-kanto": {
      "id": null,
      "url": "https://thepokeapi.com/pokedex/updated-kanto"
    },
    "conquest-gallery": {
      "id": null,
      "url": "https://thepokeapi.com/pokedex/conquest-gallery"
    },
    "original-melemele": {
      "id": null,
      "url": "https://thepokeapi.com/pokedex/original-melemele"
    },
    "updated-melemele": {
      "id": null,
      "url": "https://thepokeapi.com/pokedex/updated-melemele"
    },
    "updated-unova": {
      "id": null,
      "url": "https://thepokeapi.com/pokedex/updated-unova"
    },
    "original-ulaula": {
      "id": null,
      "url": "https://thepokeapi.com/pokedex/original-ulaula"
    },
    "original-poni": {
      "id": null,
      "url": "https://thepokeapi.com/pokedex/original-poni"
    },
    "updated-ulaula": {
      "id": null,
      "url": "https://thepokeapi.com/pokedex/updated-ulaula"
    },
    "updated-poni": {
      "id": null,
      "url": "https://thepokeapi.com/pokedex/updated-poni"
    },
    "kalos-mountain": {
      "id": null,
      "url": "https://thepokeapi.com/pokedex/kalos-mountain"
    },
    "hoenn": {
      "id": null,
      "url": "https://thepokeapi.com/pokedex/hoenn"
    },
    "original-sinnoh": {
      "id": null,
      "url": "https://thepokeapi.com/pokedex/original-sinnoh"
    },
    "extended-sinnoh": {
      "id": null,
      "url": "https://thepokeapi.com/pokedex/extended-sinnoh"
    },
    "updated-hoenn": {
      "id": null,
      "url": "https://thepokeapi.com/pokedex/updated-hoenn"
    },
    "original-unova": {
      "id": null,
      "url": "https://thepokeapi.com/pokedex/original-unova"
    }
  },
  "region": "kalos",
  "region_id": 6,
  "shape": "quadruped",
  "species": "Intertwining Pok\u00e9mon",
  "sprites": {
    "default": "https://raw.githubusercontent.com/hostedposted/PokemonData/master/sprites/pokemon/700.png",
    "shiny": "https://raw.githubusercontent.com/hostedposted/PokemonData/master/sprites/pokemon/shiny/700.png"
  },
  "stats": [
    {
      "name": "hp",
      "base_stat": 95
    },
    {
      "name": "attack",
      "base_stat": 65
    },
    {
      "name": "defense",
      "base_stat": 65
    },
    {
      "name": "special-attack",
      "base_stat": 110
    },
    {
      "name": "special-defense",
      "base_stat": 130
    },
    {
      "name": "speed",
      "base_stat": 60
    }
  ],
  "types": [
    {
      "name": "fairy",
      "url": "https://thepokeapi.com/type/fairy"
    }
  ],
  "weight_kilograms": 24,
  "weight_pounds": 52
}