{
  "abilities": [
    {
      "name": "oblivious",
      "url": "https://thepokeapi.com/ability/oblivious",
      "is_hidden": false,
      "slot": 1
    },
    {
      "name": "anticipation",
      "url": "https://thepokeapi.com/ability/anticipation",
      "is_hidden": false,
      "slot": 2
    },
    {
      "name": "hydration",
      "url": "https://thepokeapi.com/ability/hydration",
      "is_hidden": true,
      "slot": 3
    }
  ],
  "capture_rate": 190,
  "color": "gray",
  "damage_multipliers": {
    "normal": 1,
    "fire": 0,
    "water": 1,
    "electric": 0,
    "grass": 4,
    "ice": 1,
    "fighting": 1,
    "poison": 0,
    "ground": 1,
    "flying": 1,
    "psychic": 1,
    "bug": 1,
    "rock": 0,
    "ghost": 1,
    "dragon": 1,
    "dark": 1,
    "steel": 0,
    "fairy": 1
  },
  "description": "Its whiskers are filled with nerves. They can sense smells and flavors just as a person\u2019s nose or tongue would.",
  "egg_groups": [
    "water2"
  ],
  "evolution_chain": [
    [
      "barboach"
    ],
    [
      "whiscash"
    ]
  ],
  "evolves_from_species": null,
  "growth_rate": "medium",
  "height": 16,
  "id": 339,
  "is_baby": false,
  "is_legendary": false,
  "is_mythical": false,
  "moves": [
    {
      "name": "headbutt",
      "level": 0,
      "tm": false
    },
    {
      "name": "take-down",
      "tm": false,
      "level": null
    },
    {
      "name": "thrash",
      "tm": false,
      "level": null
    },
    {
      "name": "double-edge",
      "level": 0,
      "tm": false
    },
    {
      "name": "water-gun",
      "level": 11,
      "tm": false
    },
    {
      "name": "hydro-pump",
      "tm": false,
      "level": null
    },
    {
      "name": "surf",
      "tm": true,
      "level": null
    },
    {
      "name": "ice-beam",
      "tm": true,
      "level": null
    },
    {
      "name": "blizzard",
      "tm": true,
      "level": null
    },
    {
      "name": "earthquake",
      "level": 31,
      "tm": false
    },
    {
      "name": "fissure",
      "level": 41,
      "tm": false
    },
    {
      "name": "toxic",
      "tm": true,
      "level": null
    },
    {
      "name": "mimic",
      "level": 0,
      "tm": false
    },
    {
      "name": "double-team",
      "tm": true,
      "level": null
    },
    {
      "name": "waterfall",
      "tm": true,
      "level": null
    },
    {
      "name": "amnesia",
      "level": 21,
      "tm": false
    },
    {
      "name": "rest",
      "level": 26,
      "tm": false
    },
    {
      "name": "substitute",
      "level": 0,
      "tm": false
    },
    {
      "name": "snore",
      "level": 26,
      "tm": false
    },
    {
      "name": "flail",
      "tm": false,
      "level": null
    },
    {
      "name": "protect",
      "tm": true,
      "level": null
    },
    {
      "name": "mud-slap",
      "level": 1,
      "tm": false
    },
    {
      "name": "icy-wind",
      "level": 0,
      "tm": false
    },
    {
      "name": "sandstorm",
      "tm": true,
      "level": null
    },
    {
      "name": "endure",
      "level": 0,
      "tm": false
    },
    {
      "name": "swagger",
      "level": 0,
      "tm": false
    },
    {
      "name": "spark",
      "tm": false,
      "level": null
    },
    {
      "name": "attract",
      "tm": true,
      "level": null
    },
    {
      "name": "sleep-talk",
      "level": 0,
      "tm": false
    },
    {
      "name": "return",
      "tm": true,
      "level": null
    },
    {
      "name": "frustration",
      "tm": true,
      "level": null
    },
    {
      "name": "magnitude",
      "level": 16,
      "tm": false
    },
    {
      "name": "hidden-power",
      "tm": true,
      "level": null
    },
    {
      "name": "rain-dance",
      "tm": true,
      "level": null
    },
    {
      "name": "future-sight",
      "level": 36,
      "tm": false
    },
    {
      "name": "whirlpool",
      "tm": false,
      "level": null
    },
    {
      "name": "hail",
      "tm": true,
      "level": null
    },
    {
      "name": "facade",
      "tm": true,
      "level": null
    },
    {
      "name": "secret-power",
      "tm": true,
      "level": null
    },
    {
      "name": "dive",
      "tm": true,
      "level": null
    },
    {
      "name": "mud-sport",
      "level": 6,
      "tm": false
    },
    {
      "name": "rock-tomb",
      "tm": true,
      "level": null
    },
    {
      "name": "muddy-water",
      "tm": false,
      "level": null
    },
    {
      "name": "bounce",
      "level": 0,
      "tm": false
    },
    {
      "name": "mud-shot",
      "tm": false,
      "level": null
    },
    {
      "name": "water-sport",
      "level": 6,
      "tm": false
    },
    {
      "name": "dragon-dance",
      "tm": false,
      "level": null
    },
    {
      "name": "water-pulse",
      "tm": true,
      "level": null
    },
    {
      "name": "natural-gift",
      "tm": true,
      "level": null
    },
    {
      "name": "aqua-tail",
      "level": 35,
      "tm": false
    },
    {
      "name": "earth-power",
      "level": 0,
      "tm": false
    },
    {
      "name": "mud-bomb",
      "level": 14,
      "tm": false
    },
    {
      "name": "captivate",
      "tm": true,
      "level": null
    },
    {
      "name": "round",
      "tm": true,
      "level": null
    },
    {
      "name": "scald",
      "tm": true,
      "level": null
    },
    {
      "name": "bulldoze",
      "tm": true,
      "level": null
    },
    {
      "name": "confide",
      "tm": true,
      "level": null
    }
  ],
  "name": "barboach",
  "names": {
    "french": "Barloche",
    "german": "Schmerbe",
    "spanish": "Barboach",
    "italian": "Barboach",
    "english": "Barboach",
    "japanese": "\u30c9\u30b8\u30e7\u30c3\u30c1"
  },
  "pokedex_numbers": {
    "national": {
      "id": 339,
      "url": "https://thepokeapi.com/pokedex/national"
    },
    "hoenn": {
      "id": 127,
      "url": "https://thepokeapi.com/pokedex/hoenn"
    },
    "original-sinnoh": {
      "id": 80,
      "url": "https://thepokeapi.com/pokedex/original-sinnoh"
    },
    "extended-sinnoh": {
      "id": 80,
      "url": "https://thepokeapi.com/pokedex/extended-sinnoh"
    },
    "kalos-mountain": {
      "id": 40,
      "url": "https://thepokeapi.com/pokedex/kalos-mountain"
    },
    "updated-hoenn": {
      "id": 132,
      "url": "https://thepokeapi.com/pokedex/updated-hoenn"
    },
    "original-alola": {
      "id": 93,
      "url": "https://thepokeapi.com/pokedex/original-alola"
    },
    "original-melemele": {
      "id": 93,
      "url": "https://thepokeapi.com/pokedex/original-melemele"
    },
    "original-akala": {
      "id": 36,
      "url": "https://thepokeapi.com/pokedex/original-akala"
    },
    "original-poni": {
      "id": 43,
      "url": "https://thepokeapi.com/pokedex/original-poni"
    },
    "updated-alola": {
      "id": 113,
      "url": "https://thepokeapi.com/pokedex/updated-alola"
    },
    "updated-melemele": {
      "id": 113,
      "url": "https://thepokeapi.com/pokedex/updated-melemele"
    },
    "updated-akala": {
      "id": 36,
      "url": "https://thepokeapi.com/pokedex/updated-akala"
    },
    "updated-poni": {
      "id": 55,
      "url": "https://thepokeapi.com/pokedex/updated-poni"
    },
    "galar": {
      "id": 228,
      "url": "https://thepokeapi.com/pokedex/galar"
    },
    "isle-of-armor": {
      "id": 137,
      "url": "https://thepokeapi.com/pokedex/isle-of-armor"
    },
    "crown-tundra": {
      "id": 60,
      "url": "https://thepokeapi.com/pokedex/crown-tundra"
    },
    "kanto": {
      "id": null,
      "url": "https://thepokeapi.com/pokedex/kanto"
    },
    "original-johto": {
      "id": null,
      "url": "https://thepokeapi.com/pokedex/original-johto"
    },
    "updated-johto": {
      "id": null,
      "url": "https://thepokeapi.com/pokedex/updated-johto"
    },
    "kalos-central": {
      "id": null,
      "url": "https://thepokeapi.com/pokedex/kalos-central"
    },
    "updated-kanto": {
      "id": null,
      "url": "https://thepokeapi.com/pokedex/updated-kanto"
    },
    "conquest-gallery": {
      "id": null,
      "url": "https://thepokeapi.com/pokedex/conquest-gallery"
    },
    "updated-unova": {
      "id": null,
      "url": "https://thepokeapi.com/pokedex/updated-unova"
    },
    "original-ulaula": {
      "id": null,
      "url": "https://thepokeapi.com/pokedex/original-ulaula"
    },
    "updated-ulaula": {
      "id": null,
      "url": "https://thepokeapi.com/pokedex/updated-ulaula"
    },
    "kalos-coastal": {
      "id": null,
      "url": "https://thepokeapi.com/pokedex/kalos-coastal"
    },
    "original-unova": {
      "id": null,
      "url": "https://thepokeapi.com/pokedex/original-unova"
    }
  },
  "region": "hoenn",
  "region_id": 3,
  "shape": "fish",
  "species": "Whiskers Pok\u00e9mon",
  "sprites": {
    "default": "https://raw.githubusercontent.com/hostedposted/PokemonData/master/sprites/pokemon/339.png",
    "shiny": "https://raw.githubusercontent.com/hostedposted/PokemonData/master/sprites/pokemon/shiny/339.png"
  },
  "stats": [
    {
      "name": "hp",
      "base_stat": 50
    },
    {
      "name": "attack",
      "base_stat": 48
    },
    {
      "name": "defense",
      "base_stat": 43
    },
    {
      "name": "special-attack",
      "base_stat": 46
    },
    {
      "name": "special-defense",
      "base_stat": 41
    },
    {
      "name": "speed",
      "base_stat": 60
    }
  ],
  "types": [
    {
      "name": "water",
      "url": "https://thepokeapi.com/type/water"
    },
    {
      "name": "ground",
      "url": "https://thepokeapi.com/type/ground"
    }
  ],
  "weight_kilograms": 2,
  "weight_pounds": 4
}